Key,Type,Desc,English,Chinese (Simplified),French,German,Italian,Polish,Russian,Spanish,UI_Tester
TFTV_LORE_ALISTAIR_TITLE,Text,,Alistair Ashby,,Alistair Ashby,,,,,,
TFTV_LORE_ALISTAIR_DESCRIPTION,Text,,"Sometimes Alistair thought that the transformative effect of the Pandoravirus on him could not have been greater had he actually been infected with it.

Alistair went from a youthful college-dropout influencer to a bona fide expert, all by taking the first Mist stories seriously, while the rest of the media still considered them fake news. He grasped the significance of what was happening earlier and better than anyone else. He anticipated the Third World War and its consequences, including the rise of the highly polarized and ideologically charged factions, and the demise of race, wealth, nationality and family prestige as relevant sociological factors.

“We are mistaken about the coming Apocalypse. It’s not about extinction or survival. It’s about our place in the new food chain.”

The Pandoravirus also brought Alistair into contact with the child prodigy Olena Kim. They ran into each other more than two decades ago and have been inseparable ever since, to the extent that Alistair now considers himself her oppa (older brother).

The connection - if any - between Alistair and Phoenix Project remains a mystery, but it seems like he knew Randolph Symes III personally.",,"Parfois, Alistair pensait que l’effet transformateur du Pandoravirus sur lui n’aurait pas pu être plus important s’il en avait réellement été infecté.

Alistair est passé du statut de jeune influenceur ayant abandonné ses études à celui de véritable expert, tout cela en prenant au sérieux les premières histoires de Mist, alors que le reste des médias les considérait toujours comme de fausses nouvelles. Il a compris l’importance de ce qui se passait plus tôt et mieux que quiconque. Il a anticipé la Troisième Guerre mondiale et ses conséquences, notamment la montée de factions hautement polarisées et idéologiquement chargées, ainsi que la disparition de la race, de la richesse, de la nationalité et du prestige familial, comme facteurs sociologiques pertinents.

« Nous nous trompons sur l’Apocalypse à venir. Il ne s’agit pas d’extinction ou de survie. Il s’agit de notre place dans la nouvelle chaîne alimentaire.

Le Pandoravirus a également mis Alistair en contact avec l’enfant prodige Olena Kim. Ils se sont rencontrés il y a plus de vingt ans et sont depuis inséparables, à tel point qu'Alistair se considère désormais comme son oppa (frère aîné).

Le lien - le cas échéant - entre Alistair et Phoenix Project reste un mystère, mais il semble qu'il connaissait personnellement Randolph Symes III.",,,,,,
TFTV_LORE_OLENA_TITLE,Text,,Olena Kim,,Olena Kim,,,,,,
TFTV_LORE_OLENA_DESCRIPTION,Text,,"Olena was born in Odesa to a Korean father and a Ukrainian mother, both renowned scholars in archaeology and anthropology. They traveled around the world with their daughter, exposing her to different cultures and languages. A prodigy, Olena bears the imprint of a program for the gifted: an alien within her own species.

She lost her parents during the First Mist. When Alistair Ashby and his band of refugees found her, she was another shell shocked child. In time, he became her friend and confidant, one of the few people who understood her.

Olena never talks about her past unless asked directly. She prefers to focus on the present and future challenges. She is loyal to Alistair and respects his judgment, particularly as to people. She is curious about the various factions but wary of their intentions or agendas.",,"Olena est née à Odessa d'un père coréen et d'une mère ukrainienne, tous deux chercheurs renommés en archéologie et en anthropologie. Ils ont voyagé à travers le monde avec leur fille, l'exposant à différentes cultures et langues. Prodige, Olena porte l'empreinte d'un programme pour surdoués : une extraterrestre au sein de sa propre espèce.

Elle a perdu ses parents lors de la Première Brume. Quand Alistair Ashby et sa bande de réfugiés l'ont trouvée, elle était une autre enfant sous le choc. Avec le temps, il est devenu son ami et confident, l’une des rares personnes à la comprendre.

Olena ne parle jamais de son passé à moins qu'on lui demande directement. Elle préfère se concentrer sur les défis présents et futurs. Elle est fidèle à Alistair et respecte son jugement, notamment quant aux personnes. Elle est curieuse des différentes factions mais se méfie de leurs intentions ou de leurs programmes.",,,,,,
TFTV_LORE_HELENA_TITLE,Text,,Helena Lewandowski,,Hélène Lewandowski,,,,,,
TFTV_LORE_HELAN_DESCRIPTION,Text,,"Helena Lewandowski was born in Warsaw, Poland, in 1993. She had a passion for history and archaeology since she was a child, and pursued her studies at the University of Warsaw. She became one of the world’s leading experts on prehistoric cultures and civilizations, especially those that existed before the last ice age. 

In 2019, she joined Project Glory, a secretive attempt to study the nature of enigmatic ruins that predated Homo Sapiens. Project Glory was funded by the Phoenix Project and Vanadium Inc., and was led by Dr. Randolph Symes III, the director of the Phoenix Project at that time.

However, Dr. Symes did not share her enthusiasm or vision. Helena left Project Glory and joined Vanadium Inc., where she continued her research under the supervision of Tobias West, the CEO of Vanadium Inc. In 2022, when the Pandora virus began to spread across the globe, Helena uncovered evidence of an ancient civilization that had advanced technology and knowledge beyond anything known to modern humans. She contacted West and told him about her breakthrough.

However, West suddenly shut down Project Glory and ordered Helena to return to New Jericho’s headquarters. She was later transferred to a prison facility, where she remained until rescued by the Phoenix Project. ",,"Helena Lewandowski est née à Varsovie, en Pologne, en 1993. Passionnée d'histoire et d'archéologie depuis son enfance, elle a poursuivi ses études à l'Université de Varsovie. Elle est devenue l’une des plus grandes expertes mondiales en matière de cultures et de civilisations préhistoriques, en particulier celles qui existaient avant la dernière période glaciaire.

En 2019, elle rejoint le Projet Glory, une tentative secrète d'étudier la nature de ruines énigmatiques antérieures à Homo Sapiens. Le projet Glory a été financé par le projet Phoenix et Vanadium Inc. et était dirigé par le Dr Randolph Symes III, directeur du projet Phoenix à l'époque.

Cependant, le Dr Symes ne partageait ni son enthousiasme ni sa vision. Helena a quitté Project Glory et a rejoint Vanadium Inc., où elle a poursuivi ses recherches sous la supervision de Tobias West, PDG de Vanadium Inc. En 2022, lorsque le virus Pandora a commencé à se propager à travers le monde, Helena a découvert des preuves d'une ancienne civilisation qui possédait une technologie et des connaissances avancées au-delà de tout ce que connaissent les humains modernes. Elle a contacté West et lui a parlé de sa percée.

Cependant, West a soudainement arrêté le projet Glory et a ordonné à Helena de retourner au siège de New Jericho. Elle a ensuite été transférée dans un établissement pénitentiaire, où elle est restée jusqu'à ce qu'elle soit secourue par le projet Phoenix.",,,,,,
TFTV_LORE_BENNU_TITLE,Text,,Bennu,,Déterminer,,,,,,
TFTV_LORE_BENNU_DESCRIPTION,Text,,"The Phoenix Project relies on a number of Limited Artificial Intelligences: task oriented, non replicating software with limited growth potential devoid of internal personality modulators, aggregated under the namespace ""Bennu"". 

Bennu runs the life support on Phoenix bases, assists with research and manufacturing processes, and provides the Director Interface and other critical information, among many other crucial background tasks. They allow the Director maximum control in both strategic and tactical decisions. 

As a data processing unit, Bennu works to present all relevant information in the most succinct, understandable and engaging manner. Like this text here! Hope you enjoyed it!",,"Le projet Phoenix s'appuie sur un certain nombre d'intelligences artificielles limitées : des logiciels orientés tâches, non réplicatifs, avec un potentiel de croissance limité, dépourvus de modulateurs de personnalité internes, regroupés sous l'espace de noms ""Bennu"".

Bennu gère le système de survie sur les bases de Phoenix, participe aux processus de recherche et de fabrication et fournit l'interface du directeur et d'autres informations critiques, parmi de nombreuses autres tâches de fond cruciales. Ils permettent au directeur un contrôle maximal sur les décisions stratégiques et tactiques.

En tant qu'unité de traitement de données, Bennu s'efforce de présenter toutes les informations pertinentes de la manière la plus succincte, compréhensible et engageante. Aimez ce texte ici ! J'espère que vous en avez profité!",,,,,,
TFTV_TIP_GEOSCAPE_1,Text,,Accepting a Diplomacy mission from one faction will normally give you a large penalty with the other factions.,,Accepter une mission diplomatique d'une faction vous donnera normalement une grosse pénalité avec les autres factions.,,,,,,
TFTV_TIP_GEOSCAPE_2,Text,,"If you choose to postpone a Diplomacy mission, you will suffer a penalty with the offering faction, and be offered the mission again once you reach the required Diplomacy rating.",,"Si vous choisissez de reporter une mission diplomatique, vous subirez une pénalité auprès de la faction qui vous propose et la mission vous sera à nouveau proposée une fois que vous aurez atteint le niveau de diplomatie requis.",,,,,,
TFTV_TIP_GEOSCAPE_3,Text,,Void Omens can be removed by destroying Pandoran Lairs or Citadels (or Nests if you are playing on Rookie).,,Les présages du Néant peuvent être supprimés en détruisant les repaires ou les citadelles des Pandoriens (ou les nids si vous jouez en tant que Rookie).,,,,,,
TFTV_TIP_GEOSCAPE_4,Text,,Pandoran Colonies and Infested Havens speed up Pandoran Evolution.,,Les colonies Pandoriennes et les refuges infestés accélèrent l'évolution Pandorienne.,,,,,,
TFTV_TIP_GEOSCAPE_5,Text,,Beware of ambushes when exploring!,,Méfiez-vous des embuscades lors de l'exploration !,,,,,,
TFTV_TIP_GEOSCAPE_6,Text,,You can buy Faction Technologies in the Marketplace.,,Vous pouvez acheter des technologies de faction sur le marché.,,,,,,
TFTV_TIP_GEOSCAPE_7,Text,,Reverse Engineering an item will allow the player to research the underlying Faction Technology.,,L'ingénierie inverse d'un objet permettra au joueur de rechercher la technologie de faction sous-jacente.,,,,,,
TFTV_TIP_GEOSCAPE_8,Text,,You don't have to follow the Symes questline to win; activate a couple old Phoenix bases to see if there is anything interesting in their archives...,,Vous n'êtes pas obligé de suivre la série de quêtes Symes pour gagner ; activez quelques anciennes bases Phoenix pour voir s'il y a quelque chose d'intéressant dans leurs archives...,,,,,,
TFTV_TIP_GEOSCAPE_9,Text,,The FAR-M module that comes equipped on your starting Manticore adds 4 seats and stamina regeneration to everyone on board.,,Le module FAR-M fourni avec votre Manticore de départ ajoute 4 sièges et une régénération d'endurance à tout le monde à bord.,,,,,,
TFTV_TIP_GEOSCAPE_10,Text,,"There are 4 different Passenger Modules for your aircraft, each granting a different bonus in addition to the extra seats. You will unlock them as you acquire Faction Technologies.",,"Il existe 4 modules passagers différents pour votre avion, chacun accordant un bonus différent en plus des sièges supplémentaires. Vous les débloquerez en acquérant les technologies de faction.",,,,,,
TFTV_TIP_GEOSCAPE_11,Text,,"A Haven under attack will send out an S.O.S., revealing its position.",,"Un Haven attaqué enverra un S.O.S., révélant sa position.",,,,,,
TFTV_TIP_GEOSCAPE_12,Text,,Build or repair satellite uplinks at your bases to discover Points of Interest and increase the chance of detecting a Pandoran Colony after successfully defending a haven.,,Construisez ou réparez des liaisons satellites dans vos bases pour découvrir des points d'intérêt et augmenter les chances de détecter une colonie Pandorienne après avoir défendu avec succès un refuge.,,,,,,
TFTV_TIP_GEOSCAPE_13,Text,,"As long as haven leaders are not hostile to the Phoenix Project, they will continue to offer recruits, though at a higher price if they dislike you.",,"Tant que les dirigeants du refuge ne seront pas hostiles au projet Phoenix, ils continueront à proposer des recrues, mais à un prix plus élevé s'ils ne vous aiment pas.",,,,,,
TFTV_TIP_GEOSCAPE_14,Text,,"As the Oneiric Delirium advances more negative effects will come in play, including Void Omens.",,"À mesure que le délirium onirique progresse, de plus en plus d'effets négatifs entreront en jeu, y compris les présages du Néant.",,,,,,
TFTV_TIP_GEOSCAPE_15,Text,,Havens destroyed inside the Mist can become Infested.,,Les refuges détruits à l'intérieur de la Brume peuvent devenir infestés.,,,,,,
TFTV_TIP_GEOSCAPE_16,Text,,"Infested Havens cannot be saved, but unique rewards can be salvaged and some population recovered.",,"Les Havres Infestés ne peuvent pas être sauvegardés, mais des récompenses uniques peuvent être récupérées et une partie de la population récupérée.",,,,,,
TFTV_TIP_GEOSCAPE_17,Text,,"If you are looking for a challenge, check the Make Pandorans Stronger option at the start of the game. If you are still finding everything too easy, try the ETERMES difficulty. Report if you survive, would you kindly. ",,"Si vous recherchez un défi, cochez l'option Rendre les Pandoriens plus forts au début du jeu. Si vous trouvez toujours tout trop facile, essayez la difficulté ETERMES. Signalez-le si vous survivez, pourriez-vous bien vouloir le faire.",,,,,,
TFTV_TIP_GEOSCAPE_18,Text,,"If you are finding the game too hard, try playing on Story Mode or Rookie. You can also choose a different difficulty setting for the Tactical portion of the game. You can do so either on starting a new game or in the mod config.",,"Si vous trouvez le jeu trop difficile, essayez de jouer en mode Histoire ou Rookie. Vous pouvez également choisir un niveau de difficulté différent pour la partie tactique du jeu. Vous pouvez le faire soit au démarrage d'un nouveau jeu, soit dans la configuration du mod.",,,,,,
TFTV_TIP_GEOSCAPE_19,Text,,"If you run into any Error Messages or other bugs, please report them in our #bug-reporting channel at the Terror from the Void Discord server.",,"Si vous rencontrez des messages d'erreur ou d'autres bugs, veuillez les signaler dans notre canal #bug-reporting sur le serveur Discord 'Terror from the Void'.",,,,,,
TFTV_TIP_TACTICAL_1,Text,,The total amount of Delirium of all your operatives present on the mission determines the chance that an Arthron or a Triton will be Touched by the Void.,,Le montant total de Delirium de tous vos agents présents sur la mission détermine la chance qu'un Arthron ou un Triton soit touché par le Néant.,,,,,,
TFTV_TIP_TACTICAL_2,Text,,"Umbras can only attack characters that have at least one Delirium point, or are inside the Mist.",,Les Umbras ne peuvent attaquer que les personnages qui ont au moins un point de Délirium ou qui se trouvent à l'intérieur de la Brume.,,,,,,
TFTV_TIP_TACTICAL_3,Text,,The impact of Delirium on Willpower is weakened if your operative is well rested. Every 10 Stamina will reduce the effect of Delirium on Willpower by 1.,,L'impact du Délirium sur la Volonté est affaibli si votre agent est bien reposé. Toutes les 10 endurances réduiront l’effet du délirium sur la volonté de 1.,,,,,,
TFTV_TIP_TACTICAL_4,Text,,"If a body part is disabled in battle, the operative's Stamina will drop to 0 after the mission.",,"Si une partie du corps est désactivée au combat, l'endurance de l'agent tombera à 0 après la mission.",,,,,,
TFTV_TIP_TACTICAL_5,Text,,"The bigger Pandorans will ignore smaller critters, drones and turrets, and walk over them, or squash them.",,"Les plus gros Pandoriens ignoreront les petites créatures, les drones et les tourelles, et marcheront dessus ou les écraseront.",,,,,,
TFTV_TIP_TACTICAL_6,Text,,Decoys and imaginary (or are they?) monsters don't stop bullets.,,Les leurres et les monstres imaginaires (ou le sont-ils ?) n'arrêtent pas les balles.,,,,,,
TFTV_TIP_TACTICAL_7,Text,,"If you are looking for a challenge, check the Make Pandorans Stronger option at the start of the game. If you are still finding everything too easy, try the ETERMES difficulty. Report if you survive, would you kindly. ",,"Si vous recherchez un défi, cochez l'option Rendre les Pandoriens plus forts au début du jeu. Si vous trouvez toujours tout trop facile, essayez la difficulté ETERMES. Signalez-le si vous survivez, pourriez-vous bien vouloir le faire.",,,,,,
TFTV_TIP_TACTICAL_8,Text,,"If you are finding the game too hard, try playing on Story Mode or Rookie. You can also choose a different difficulty setting for the Tactical portion of the game. You can do so either on starting a new game or in the mod config.",,"Si vous trouvez le jeu trop difficile, essayez de jouer en mode Histoire ou Rookie. Vous pouvez également choisir un niveau de difficulté différent pour la partie tactique du jeu. Vous pouvez le faire soit au démarrage d'un nouveau jeu, soit dans la configuration du mod.",,,,,,
TFTV_TIP_TACTICAL_9,Text,,"If you run into any Error Messages or other bugs, please report them in our #bug-reporting channel at the Phoenix Rising Discord server.",,"Si vous rencontrez des messages d'erreur ou d'autres bugs, veuillez les signaler sur notre canal #bug-reporting sur le serveur Discord 'Phoenix Rising'.",,,,,,
TFTV_TIP_TACTICAL_10,Text,,Smart adversaries will realize fast that they are attacking a decoy.,,Les adversaires intelligents se rendront vite compte qu’ils attaquent un leurre.,,,,,,
TFTV_TIP_GEOSCAPE_20,Text,,The volume of Pandorans that a craft is able to extract is equal to its carrying capacity when equipped with a passenger module.,,Le volume de Pandoriens qu'un engin est capable d'extraire après capture est égal à sa capacité d'emport lorsqu'il est équipé d'un module passagers.,,,,,,
TFTV_TIP_GEOSCAPE_21,Text,,Only one aircraft can be used for extracting paralyzed Pandorans for capture. The game will automatically pick the one with the largest capture capacity.,,Un seul avion peut être utilisé pour extraire les Pandoriens paralysés en vue de leur capture. Le jeu choisira automatiquement celui ayant la plus grande capacité de capture.,,,,,,
TFTV_TIP_GEOSCAPE_22,Text,,If you have built a Containment Facility the game will automatically try to extract the most valuable of the paralyzed Pandorans at the end of a successful mission.,,"Si vous avez construit une installation de confinement, le jeu tentera automatiquement d'extraire le plus précieux des Pandoriens paralysés à la fin d'une mission réussie.",,,,,,
TFTV_TIP_GEOSCAPE_23,Text,,"If you want to ensure that a lower value Pandoran gets captured, click on the fully paralyzed Pandoran and choose that option in the dropdown menu. Do the same to remove the mark.",,"Si vous voulez vous assurer qu'un Pandorien de valeur inférieure est capturé, cliquez sur le Pandorien complètement paralysé et choisissez cette option dans le menu déroulant. Faites de même pour supprimer la marque.",,,,,,
TFTV_TIP_GEOSCAPE_24,Text,,Scyllas are big! You will need a special module to capture them.,,Les Scyllas sont grandes ! Vous aurez besoin d'un module spécial pour les capturer.,,,,,,
TFTV_TIP_GEOSCAPE_25,Text,,"If you have a Mutation Lab, captured Pandorans will generate Mutagens every hour. Each Mutation Lab can generate up to 50 Mutagens per day.",,"Si vous disposez d'un laboratoire de mutation, les Pandoriens capturés généreront des mutagènes toutes les heures. Chaque laboratoire de mutation peut générer jusqu'à 50 mutagènes par jour.",,,,,,
TFTV_TIP_GEOSCAPE_26,Text,,"If you have a Food Production facility you can process captured Pandorans, turning them into food. Each of these facilities can process 50 units of Pandoran meat per day.",,"Si vous disposez d'une installation de production alimentaire, vous pouvez y transférer les Pandoriens capturés et les transformer en nourriture. Chacune de ces installations peut traiter 50 unités de viande Pandorienne par jour.",,,,,,
TFTV_TIP_GEOSCAPE_27,Text,,Do you recall the legend of Fort Bacon?,,Vous souvenez-vous de la légende de Fort Bacon ?,,,,,,
TFTV_TIP_GEOSCAPE_28,Text,,Containment facilities housing captured Pandoran life forms are perfectly secure. You have absolutely nothing to worry about.,,Les installations de confinement hébergeant les formes de vie Pandora capturées sont parfaitement sécurisées. Vous n'avez absolument rien à craindre.,,,,,,
TFTV_TIP_GEOSCAPE_29,Text,,Project Cornucopia is made of fishpeople! It’s made of fishpeople!,,Le projet Cornucopia est composé d'hommes-poissons ! C’est fait de poissons !,,,,,,
TFTV_TIP_GEOSCAPE_30,Text,,There are no known health risks associated with consuming nutrients derived from our autonomous Food Production facilities.,,Il n'y a aucun risque connu pour la santé associé à la consommation de nutriments dérivés de nos installations autonomes de production alimentaire.,,,,,,
TFTV_TIP_GEOSCAPE_31,Text,,"If your system, or you, are struggling with the Mist from the More Mist Void Omen, you can turn it off in the Mod settings.",,"Si votre système, ou vous-même, rencontrez des difficultés avec la brume du More Mist Void Omen, vous pouvez la désactiver dans les paramètres du Mod.",,,,,,
TFTV_TIP_GEOSCAPE_32,Text,,"If the Limited Deployment Void Omen is too much for you, you can turn it off on new game start or in Mod settings.",,"Si le Présage du Néant de déploiement limité est trop dur pour vous, vous pouvez le désactiver au démarrage d'un nouveau jeu ou dans les paramètres du Mod.",,,,,,
TFTV_TIP_GEOSCAPE_33,Text,,You don't need an aircraft at the Bazaar to buy things! We deliver!,,Vous n'avez pas besoin d'un avion au Bazar pour acheter des choses ! Nous livrons!,,,,,,
TFTV_TIP_GEOSCAPE_34,Text,,Mercenaries refuse to be augmentend or mutated.,,"Les mercenaires refusent d'être augmentés ou mutés.",,,,,,
KEY_TACTICAL_LOADING_TIP_4,Text,,The Berserker's Dash ability allows a soldier to move up to half its movement range for 1 Action Point.,,La capacité 'Dash' du Berserker permet à un soldat de se déplacer jusqu'à la moitié de sa portée de mouvement pour 1 point d'action.,,,,,,
KEY_DAMAGE_TYPE_ACID_DESC,Text,,"ACID damage sticks to individual body parts - each turn it applies damage to armor first (ignoring temporary armor granted by Electric Reinforcement and similar), then body. Electronic body parts are disabled if their HP are reduced by Acid. Acid Resistance reduces damage from Acid to body parts by 50%. Acid levels reduce by 10 each turn. ",,"Les dégâts d'ACIDE s'appliquent aux différentes parties du corps - à chaque tour, ils s'appliquent d'abord à l'armure (en ignorant l'armure temporaire accordée par le Renforcement électrique et autres), puis au corps. Les parties électroniques du corps sont désactivées si leurs HP sont réduits par l'acide. La résistance à l'acide réduit de 50 % les dégâts causés par l'acide aux parties du corps. Le niveau d'acide est réduit de 10 à chaque tour. ",,,,,,
KEY_ACID_RESISTANCE_DESCRIPTION,Text,,Reduces damage from Acid to body parts by 50%.,,"Réduit de 50 % les dégâts causés par l'acide aux parties du corps.",,,,,,
KEY_TACTICAL_LOADING_TIP_28,Text,,"Acid damage attached to body parts will damage armor first (ignoring temporary armor granted by Electric Reinforcement and similar), and then body parts. Electronic body parts are disabled if their HP are reduced by Acid. Acid Resistance reduces damage from Acid to body parts by 50%. Remaining acid levels decrease by 10 each turn.",,"Les dégâts d'acide infligés aux parties du corps endommagent d'abord l'armure (en ignorant l'armure temporaire accordée par le renforcement électrique et autres), puis les parties du corps. Les parties électroniques du corps sont désactivées si leurs HP sont réduits par l'acide. La résistance à l'acide réduit de 50 % les dégâts causés par l'acide aux parties du corps. Les niveaux d'acide restants diminuent de 10 à chaque tour.",,,,,,
KEY_TACTICAL_LOADING_TIP_26,Text,,"Poison will inflict damage and reduce WP at the start of the turn, and then the poison value will decrease, and inflict less damage on the next turn, until no poison is left. A poisoned character has a 50% penalty to aim.",,"Le poison inflige des dégâts et réduit la Volonté au début du tour, puis la valeur du poison diminue et inflige moins de dégâts au tour suivant, jusqu'à ce qu'il n'y ait plus de poison. Un personnage empoisonné a une pénalité de 50 % pour viser.",,,,,,
KEY_GEOSCAPE_LOADING_TIP_9,Text,,"Most of the interesting technology is possessed by the factions - to get access to it, you can 1) ally with them, 2) steal it from them, 3) reverse engineer their items to get access to the underlying technology, or 4) buy it in the Marketplace.",,"La plupart des technologies intéressantes sont détenues par les factions. Pour y accéder, vous pouvez 1) vous allier avec elles, 2) les voler, 3) faire de la rétro-ingénierie sur leurs objets pour accéder à la technologie sous-jacente, ou 4) les acheter sur le Marché.",,,,,,
